{
  "title": "Echoes of the Nebula Relay",
  "genre": "space opera",
  "themes": [
    "trust vs expedience",
    "power asymmetry"
  ],
  "rating": "PG-13",
  "length_goal_words": 20000,
  "art_ratio": 0.2,
  "threads": [
    "main"
  ],
  "genre_pack": "genre_space_opera_v1",
  "version": "1.0.0"
}
